{
  "run_id": "439b1a83-1bea-450b-8ce9-45fa90adbf5d",
  "task_id": "generated_af8d7eb4",
  "user_prompt": "Demonstrate a generic agent interaction.",
  "model_version": "generated-v1",
  "steps": [
    {
      "step_id": "s1",
      "type": "thought",
      "actor_id": "agent",
      "content": "Thinking about the task."
    },
    {
      "step_id": "s2",
      "type": "tool_call",
      "actor_id": "agent",
      "content": "Calling search tool",
      "tool_name": "search",
      "tool_input": {
        "query": "test"
      }
    },
    {
      "step_id": "s3",
      "type": "observation",
      "actor_id": "tool",
      "content": "Search returned results.",
      "tool_output": "result data"
    },
    {
      "step_id": "s4",
      "type": "final_answer",
      "actor_id": "agent",
      "content": "Here is the answer."
    }
  ],
  "metadata": {
    "timestamp": "1777930903705",
    "latency_ms": 0
  }
}
